Job Title,Company,Company Link,Date,Date Text,Job Link,Insights,Description Length,Description
Senior Electrical Engineer,"PRVN Consultants, Inc.",https://www.linkedin.com/company/prvn-consultants-inc-/life,,2 hours ago,https://www.linkedin.com/jobs/view/4317953370/?eBP=CwEAAAGaEsbBEDtquBJ9P0t7eJneZ_fGK42cQIkOblw4wUcbhojxtbvFWzm-TAGR5ANPYWp0ac70x0rskNXd_BZiaQGF20qKt_JjmOzqplyVYjuDNljarXuxThRYcmnfsonzDVgOcEI7hd4XbtDJPEmyNaePgTt7UhWLTccHn23YsqRyCAU6JzfiGjlHTPPdbyXf4tsED9JCMFOxeXIzSzq4GFFzbG-O0UxNTPEjwtc3Nokc_-DR4fjNWVQJcdhzRRmUHiKml5ElWKeTDlvAL0kpuAMLm2C4izrpAgtWUZdgYW2xBVh1Rr9nUaSv1PoABQD2Mypnic_8AhxqMQQaj9CTKFuSh1oJGr78w3MH56xvVYG3k7LbRx_GYI03GPEsXHteFtyCbSXGYMvaje06p15XspDWHXrGYlJ6_MDanzc4YbSqIYwzT1M4wHejeNyPH7sjqnDF02e0erD9wNpVX5kb&refId=TF%2Fuq6CcUN8B5fpRHYLOdg%3D%3D&trackingId=NIHWV%2FSTa4RROKZ9e5TeOA%3D%3D&trk=flagship3_search_srp_jobs,,4076,"About the job  Our PRoVeN design team consists of professional individuals in a high-energy workplace at a growing company. Self-starters with strong analytical and problem-solving skills will excel.  About the Company  PRVN Consultants, Inc. is a leading, multidisciplinary consulting engineering firm that works in the district energy (heating, cooling, and electrical generation) and combined heat and power (CHP) arena with of over 45employees in 4 offices across the Midwest. We bring our clients the experience of a large firm, with the personal service of a small firm, while remaining nimble and flexible in our approach.  Since we were established in 2011, we have continued to expand our services and expertise. Our unique pool of talent uses upfront collaboration, advanced problem solving, and fresh thinking to find practical and efficient solutions to complex challenges.  Position Summary  PRVN Consultants, Inc. is looking for a motivated Mechanical Engineer with 5 to 12 years’ experience. As an [Senior Engineer I (Electrical)] [Senior Engineer I (Controls)] or [Senior Engineer II (Electrical)] [Senior Engineer II (Controls)] in our [Iowa City, IA] [Lafayette, IN] [Rock Island, IL] office, you will help us deliver energy efficient and sustainable solutions to the complex energy challenges faced by our institutional, utility, and industrial clients.  In this role, you will exercise engineering judgment and executing detail-oriented electrical and/or controls engineering design tasks supporting projects in a consulting environment for the industrial, institutional, and utility sectors. This role also provides technical assistance and guidance as well as quality control/quality assurance reviews for junior level engineers and peers. Projects include engine generators, steam turbine generators, steam and hot water boilers, power generation, combined heat and power, central chilled water, campus-type utility distribution systems, industrial/process facilities, and more.  Our PRoVeN design team consists of professional individuals in a high-energy workplace at a growing company. A self-starter with strong analytical and problem-solving skills will excel.  Minimum Requirements  Responsibilities include leading a team of electrical and/or controls engineers assigned to projects as a task lead, being the Engineer of Record for electrical discipline on projects, overseeing and training junior staff and designers, collaborating with professionals, other engineers, planners, and infrastructure authorities, and assisting with proposals and business development opportunities. Engineering tasks include design and specification power distribution systems, preparation of equipment specifications, one-line diagrams, short circuit and load flow calculations, protection relay selection and coordination, and preparing wiring diagrams. You will also have the opportunity to provide factory-acceptance testing and construction/commissioning field support for our local client base.  Background requirements include an engineering degree of four years or more that is accredited by the Engineering Accreditation Commission of ABET (EAC/ABET) in [electrical] [controls] engineering or closely related discipline, 5-12 years’ experience, and knowledge of practical application of engineering science and technology. This includes applying principles, techniques, procedures, and equipment to execute and design tasks as assigned.  In addition, candidates must possess good communication and organizational skills and have passed the Principals and Practice of Engineering (PE) and become a licensed professional engineer in at least one State having fulfilled all prerequisites and registrations.  Benefits and Wages  Salary is above industry average. Excellent benefits include flexible and casual work environment, including optional four 10-hour-day work weeks; health, dental, vision, life, and disability insurance coverage; 401k; and eligible for generous profit-sharing program. Range is based on applicant qualifications. $115,000 - 160,000"
Freelance Media Planner,Next Rodeo,https://www.linkedin.com/company/next-rodeo/life,,1 hour ago,https://www.linkedin.com/jobs/view/4319081919/?eBP=CwEAAAGaEsbBEFa0NR1CxtrXwz4gdc_Qe5s81pjvNobSuJsa99jDD-jhiLQglALKt7bm5282ijag_PWt7SazS7wgOrLMKmnustmbLRtqPD9UUp4RtyuHIfwyV8n6-rN6Ek66Iz8ZopqxkLPiKQIAcgzWZL03QtcJsRdTatqfCK4p1sNQE-z-WsZor0dndupTLaK9U24v0oDjloD3dMlPRSkm7m_cjYQKxIpTqI2_KQe99neeXAMGIJZTd3daj5HSPJ89OrfIG7eexkabZS5V6kDIduMTNN42v7PpouAkKmj30MZhIyQskF4ETsCwm46Gdq1leVPpFvFUbs_lwd9AH4qo-4cJk-R8F4zOxMnyrTNSLrSyyk6FpX7oP46CcAp8aCrhQvOW8jc8qqbLZigIQLOR0fNHVSwXdyiC3vahBPZg-V6d7GJfM-mgcVWGjPqEh1iNI2w6j--vUdyNUS_dFQ&refId=TF%2Fuq6CcUN8B5fpRHYLOdg%3D%3D&trackingId=hUtlScVqbVD18S%2FjWmUhhg%3D%3D&trk=flagship3_search_srp_jobs,,3048,"About the job  Freelance Media Planner     Location: Remote (Freelance/Contract), with preference for candidates based in the West Palm Beach, Florida area.     About the Role  Next Rodeo is looking for a strategic and data-driven Freelance Media Planner to join our team on a project basis. As a key collaborator, you will be responsible for developing and executing media plans that ensure our creative work reaches the right audience in the most effective way. You will work closely with our creative and media teams to align recommendations with campaign goals, leveraging data and insights to maximize impact for our clients. This is an excellent opportunity for an experienced media professional to contribute to an innovative agency model that is shaping the future of creative services.     Key Responsibilities  Develop comprehensive, cross-channel media plans and strategies for a range of small to mid-sized business clients. Conduct audience and market research to identify key insights and opportunities for media placement. Analyze data to inform media mix decisions, budget allocations, and campaign flighting. Collaborate with internal teams to ensure creative assets are optimized for specific media channels. Prepare and present media recommendations and performance reports to internal stakeholders and clients. Monitor campaign performance, providing optimization recommendations to ensure KPIs are met. Stay current with emerging media trends, platforms, and technologies to bring innovative ideas to the table.     Qualifications and Skills  3-5+ years of experience in media planning, preferably within an agency environment. Proven track record of developing and executing successful media strategies across digital and traditional channels. Strong analytical skills and proficiency with media planning and research tools. Deep understanding of the media landscape, including paid search, social, display, video, and programmatic advertising. Excellent communication and presentation skills, with the ability to articulate complex strategies clearly. A highly organized, self-starter mentality, capable of managing projects independently. Experience working with creative teams and a solid understanding of how media and creative work together. A collaborative mindset and a passion for driving measurable results for clients.     About Next Rodeo  Next Rodeo is a next-generation creative agency where strategic insight meets cutting-  edge invention. We are designed for a new era, combining seasoned human experience  with the power of technological innovation to blaze new trails for small to mid-sized  businesses. Our approach harnesses the timeless power of storytelling and amplifies it  with AI to create authentic, impactful work faster and smarter than ever before. By  integrating human creativity with technology, Next Rodeo turns experience into  advantage and power into acceleration for our clients. We are relentless in our pursuit of  powerful ideas that build brands, shift perceptions, and drive results."
Software Engineer,Tensormesh,https://www.linkedin.com/company/tensormesh/life,,1 hour ago,https://www.linkedin.com/jobs/view/4317933086/?eBP=CwEAAAGaEsc3VevdeawpOJqnPvtcdRovUXQdDZXxliBsImwMZiKOK_PtpPVQtw4fCz4ppfNmd5xysuvu_A8FyQyxoY84yit9kl64UGeaHP2d6Iz4NJ5XHc2oMdIg7K5RpMUHoAfzVSsxxzaQdllSEM-r8Sx6XDW5Gp44v29PlZjkHC7oEQUaFpGFIv8so9lR0IJvo_nlT76mQl-3YoqjQJ1bqWlTvigIkVS8VJd27V-blWekWJ40_6jZSIrrI7WHLoeji6ChWqkfxZiztAiHfONUNq76HCo7WQ7pwulSr6UEs5fBRuDxrd2fu71rM75JnEh1hsaxHgyENDopfaDhk4EHUBEUuTqYqaOkN-FJEHFcxsWUIewOAzWdrRNZNkkha0tj0SXmPHtx9RLz12LRp1nXZF0wS6TDcxJ9J8siW1-pc5uWeeqERQwU_ecH3F7ZHHaqWLc56zr5pPOU_VGRaA&refId=HkRVxPpl27AFiIQ6OImcZQ%3D%3D&trackingId=osGNZZaT5XclPEbVXqxIhw%3D%3D&trk=flagship3_search_srp_jobs,,1989,"About the job  Tensormesh is building the next generation of AI inference infrastructure. Our mission is to make large language models faster, cheaper, and easier to deploy across any environment — cloud, on-prem, or hybrid. We help enterprises and AI teams optimize GPU utilization and scale inference workloads with up to 10× better performance.     About the role  As a Backend Software Engineer at tensormesh, you’ll help build the systems that power large-scale, high-performance LLM inference. You’ll design, optimize, and scale core backend components that support caching, orchestration, and observability across multi-cloud environments.     What you’ll do  Design and implement distributed systems for high-throughput, low-latency inference workloads Build and evolve APIs and services supporting LMCache, vLLM, and multi-cloud GPU orchestration Develop pipelines for tracking, storing, and analyzing model performance and usage data Integrate with major model providers and frameworks to improve interoperability and efficiency Collaborate with product and research teams to deliver new platform capabilities end-to-end     Ideal candidate credentials  5+ years of backend engineering experience building distributed or high-scale systems Strong background in performance optimization, data integrity, and system reliability Proficient in backend technologies like Go, Python, Rust, Postgres, Redis, and Docker (AWS/GCP a plus) Familiarity with observability and monitoring tools (Prometheus, Grafana, Datadog, etc.) Clear communicator and team player who documents well and ships quickly     Benefits include  Medical, dental, and vision insurance  401k plan  Daily lunch, snacks, and beverages  Flexible time off  Competitive salary and equity     Equal opportunity  Tensormesh is an equal opportunity employer. All applicants will be considered without regard to race, color, religion, sex, sexual orientation, gender identity, national origin, veteran, or disability status."
Business Analyst,"SZ PM Consultants, Inc.",https://www.linkedin.com/company/sz-pm-consultants-inc-/life,,14 minutes ago,https://www.linkedin.com/jobs/view/4323916282/?eBP=CwEAAAGaEsc3VdpGY9b6fopdcMEES0B1gRZz_UQliZQ4EV0zqQP8It2Ukm8_GQmHbhjj5qj67z3iCHIOk_8jeV2_30WDXWDcAtGoe3RLUjlvc6HdJ_lOmwel6Bq5mZqH854QsgARoRWEC2MFsXmTrf3uO60G280VRi_yjhcKfpDtahqXextTMBvtQfFVJwP_QcNqhMSXmbWrSSTnJBXaUya35Eft6b6LPSj9eV7gvzw7UgcUkysF-_6QCVnWsdaUDOGNe6wa54PzBa8eZKUC9_2UuqXPyyudmPi4ezgPCWqb-vnCG9ph6dd2uc2UDC34osWQA0kkTwjPoheaHOgKPDCZGtwMHCT3dF294lZY0aVcNoaZhkU002cRoFPsttYmRxB7PNi_TV-C-3ewuHmuTQKPfMeG8xf2HyMAKi34xbpTQ_5A3yvKt5Qf2RjWyeFKFRsdapmLUUbj-n9r45xEvg&refId=HkRVxPpl27AFiIQ6OImcZQ%3D%3D&trackingId=NuYn4lUK4DdwI5nSp5gOyQ%3D%3D&trk=flagship3_search_srp_jobs,,2913,"About the job  Data / Business Analyst – Long-Range Access Development (Washington, DC)     Company Description   SZ PM Consultants, Inc. is a multidisciplinary engineering and consulting firm providing project management, construction oversight, and data analytics support services throughout the Washington, DC metropolitan region. We deliver innovative and data-driven solutions that enhance infrastructure performance and operational efficiency across transportation and public works programs.     Role Description   We are seeking a full-time Data / Business Analyst to support long-range access planning, project controls, and communication initiatives for a major infrastructure program. The successful candidate will play a critical role in data analytics, process improvement, and performance reporting to support decision-making and enhance operational efficiency.  The ideal candidate is highly organized, analytical, and adept at presenting data and insights in a clear and meaningful way for stakeholders. This is a full-time position based in Washington, DC.     Essential Duties and Responsibilities  Support leadership with research, analysis, and communications related to long-range scheduling, access planning, and performance tracking. Conduct both quantitative and qualitative analyses to identify business process improvements and root causes of operational challenges. Produce high-quality documents and visual materials including process maps, dashboards, presentations, policies, and procedures. Gather, organize, and evaluate diverse datasets through surveys, workshops, interviews, and task analysis. Document processes, data requirements, risks, and system gaps to inform business and technical improvements. Develop communication materials and reporting tools for internal distribution and stakeholder engagement. Present findings and dashboards to management teams in a clear and concise format suitable for decision-making.     Required Skills and Abilities  Strong proficiency with Microsoft Office 365 applications, including advanced Excel, Word, PowerPoint, and Power BI. Experience developing dashboards, conducting statistical or performance analyses, and creating professional presentation materials. Excellent writing, communication, and analytical skills. Ability to work independently and manage multiple priorities in a fast-paced environment.     Education and Experience  Bachelor’s degree in Business Administration, Management, Information Technology, or a related field. Minimum of 3 years of experience in business process improvement, data analysis, and project reporting. Experience with process mapping, risk analysis, and developing data tools preferred.     Equal Employment Opportunity   SZ PM Consultants, Inc. is an equal opportunity employer. We value diversity in our workforce and welcome applications from individuals of all backgrounds and experiences."
Full Stack Engineer,Protech Talent,https://www.linkedin.com/company/protech-talent/life,,1 hour ago,https://www.linkedin.com/jobs/view/4319085682/?eBP=CwEAAAGaEsc3VdUEfLX5-oYpPwvXYQvzQU8AhL9UP4Gy5iOmHImmCfZd8TMDWtho_3CoZJuukgwp4Cz7pW5Xk3lpuC-nDZK93-5ocJKOU8KF0ZA1P-CrD2BQ9I352fGuk-MklWmoZsz_onmCJ2sh-WFjwASAT7XmB3mJ8FQG6VwGZ0DqMXEKVnkQLtcdO_2Czq73xtmOdlsF0BPUFAqUAak1Ehi73OKKgYE12GZFYiSB3KRZDYb6rNcJD0tXCDNiN8ZDlr0JyukEehDVwHoyAl_AIpU_gWjFDoou4BO-3rJCtmLBBExlwdigik0Uj2Eye-4Z0Rf7H0CMPoJzxrMHhyq4tr7r1Wil8ZM7sfIovjaV8ToeT6TKma_-CeLVUk-9NlRSmEnngwubOhURF6UFTN30LrTwnM6iPHvgK7fs4CiDnfq4CNYQC_-D6IGcy_Mg-_7wp-xvMB_Gx3OE1WU631_QEIKthHWwUees6pXWApx0fsrhEOhZGmTbqxEHsgTc4-4&refId=HkRVxPpl27AFiIQ6OImcZQ%3D%3D&trackingId=OP9sHKxYmAmyd7f9%2FGDlUQ%3D%3D&trk=flagship3_search_srp_jobs,,6217,"About the job  Fullstack Software Engineer     Location: New York City, Hybrid     Salary: $160–300k + Equity     Start Date: ASAP     Company:     Our client is one of the fastest-growing early-stage fintech startups in the US, automating financial operating systems for small businesses. Backed by a powerful mission and early traction, the company is using cutting-edge tech to rebuild trust and financial access for the tens of millions of small businesses, that need modern financial software that works for them.     Small businesses, such as community pharmacies and independent auto dealers, are the heart of the US economy. However, due to the rise of AI, A digital economy, private equity consolidation, and inflationary pressures, a massive operational gap is forming between these SMBs and larger enterprises / tech-forward industries. These larger companies employ full finance teams and leverage the latest finance software. Small businesses deserve the same resources.     This role is ideal for someone who wants to be early at a fintech Rocketship, close to product and customers, and have a transformative career experience. You’ll help rewrite the financial future of America’s SMBs — and be deeply proud of what you’ve built.     About the Product:     The platform is transforming how SMBs manage finances. By combining automation, data intelligence, and embedded finance, they’re closing the gap between legacy spreadsheets and the sophisticated tools used by large enterprises.     Think: vertical SaaS + fintech infra + AI-powered insights, purpose-built for businesses like community pharmacies and auto dealers that are grinding it out daily without the tools they deserve.     Funding & ARR:     Achieved a $17 million Series A, 6 months after Seed funding. Achieved $7 million in ARR with a team of 10 people in 15 months.     About the Team:     The company is led by two founders from UC Berkeley, who have already had success with founding and investing into companies, who have built relationships with business owners from the ground up, earning their trust in a sector plagued by scepticism. Now, they’re partnered with influential trade associations across the country, to onboard their clients with the entities that will support them. They are operating in all 50 states (plus Puerto Rico), with concentration in states like Tennessee, Oklahoma, and Missouri.     The team is currently 10 people and operates in-person from a beautiful Flatiron-based office in NYC. They’re hands-on, ambitious, and customer obsessed. This is a team that doesn’t punch the clock, just like their customers don’t. deep product immersion is part of the culture, and they pride themselves on doing what it takes to deliver.     If you’re looking for a cushy Big Tech gig, this isn’t it. But if you want to stretch yourself, grow fast, and build something that matters — this could be your career-defining moment.     About the Role:     As a Fullstack Engineer, you’ll be responsible for shaping the financial backbone of American SMBs by building the systems that unlock financial data and intelligence, automate work-flows, and co-pilot their decisions. Your expertise won't just be used to build software. It will empower the tens of millions of hard-working SMB owners across America.     Responsibilities:  Own and lead full-stack development across the lifecycle: architecture, coding, testing, deployment, and production support. Collaborate closely with internal stakeholders and SMB customers to translate business challenges into robust technical solutions. Refine engineering tools, processes, and systems to scale productivity and improve quality. Play a key role in shaping the engineering culture and best practices. Contribute beyond engineering — we value builders who lean in on product, design, and business too.     Tech Stack:     Frontend/Backend: JavaScript, TypeScript, React, Node.js or Python or GO Infrastructure: AWS Other Tools: SQL, CI/CD pipelines, containerized microservices (Docker/Kubernetes a plus)     Your Experience:     2–15 years of experience as a Fullstack engineer with React & Node or another modern backend programming language such as Python or GO  Can be backend of frontend leaning  Strong foundation in CS (preferably from a top-tier school or equivalent experience). History of early-stage startup or founding engineer experience. Demonstrated experience shipping 0–1 products and architecting end-to-end solutions. SQL schema design and hands-on backend development are core strengths. Worked in environments with fast-paced iteration, ambiguity, and a deep customer focus. Passionate about the mission and long-term impact of empowering underserved business owners.     You will be a cultural fit if…     You’ve had fast career progression (Senior/Staff-level growth early in your career). You have a high-ownership mentality, you treat code, product, and customer outcomes as your responsibility. You drive your own results and are proactive at solving problems. You thrive in high-accountability, high-reward environments. You want to work in person with driven peers to iterate fast, learn fast, and win fast. You’ve interned or worked at top-tier startups or tech companies. You’re relentlessly curious and think like a founder, you ask business questions and want to understand “why” just as much as “how.” You are an intelligent individual with analytical thinking, problem solving skills and can communicate eloquently. You want to push yourself, the company and the team to be the best and have the confidence to give your opinion on topics.     Benefits:     Competitive salary & equity 100% employer-paid Health, Dental, and Vision insurance Relocation reimbursement to NYC Daily team-provided lunch & dinner (in-office) Paid tech setup (laptop, monitor, peripherals) Beautiful Flatiron office     Interview Process:     Intro Call with Co-Founder Second Call with other Co-Founder Technical Interview One focused on architecture and a case study with the engineering team Once focused on backend Design and coding Final Pre-Offer Meeting Culture fit, Q&A, compensation alignment ✔️ Fast decision turnaround — you’ll know where you stand."
