Job Title,Company,Company Link,Date,Date Text,Job Link,Insights,Description Length,Description
Fullstack Software Engineer - Core with verification,Dataiku,https://www.linkedin.com/company/dataiku/life,,55 minutes ago,https://www.linkedin.com/jobs/view/4316282461/?eBP=NOT_ELIGIBLE_FOR_CHARGING&refId=i2O3%2Fgau2pv%2ByovbJVbZZw%3D%3D&trackingId=BUTahOuS%2F5W6LiudQurEaA%3D%3D&trk=flagship3_search_srp_jobs,,6318,"About the job  Dataiku is The Universal AI Platform™, giving organizations control over their AI talent, processes, and technologies to unleash the creation of analytics, models, and agents. Providing no-, low-, and full-code capabilities, Dataiku meets teams where they are today, allowing them to begin building with AI using their existing skills and knowledge.  Why Engineering at Dataiku?  Dataiku’s on-premise, cloud, or SaaS-deployed platform connects many data science technologies, and our technology stack reflects our commitment to quality and innovation. We integrate the best of data and AI tech, selecting tools that truly enhance our product. From the latest LLMs to our dedication to open source communities, you'll work with a dynamic range of technologies and contribute to the collective knowledge of global tech innovators. You can find out even more about working in Engineering at Dataiku by taking a look here.  Here are some useful links so you preview what we do at Dataiku: Dataiku's Key Capabilities ; Dataiku's Github, you can also take a look at the Gallery, a public instance showcasing some example projects (note editing is very limited and will be regularly reset).  Our product is called Dataiku DSS which stands for Dataiku Data Science Studio. If you’d like to know more about it, you can watch the demo here or try the free version here.  How You’ll Make An Impact  This position is either onsite/hybrid from our Berlin office or full remote from any part of Germany.  As a Fullstack Engineer, you’ll contribute to building Dataiku DSS core features by joining one of the following themes:   Data Preparation: Develop tools for data integration, transformation, and cataloging, as well as Jupyter notebooks, SQL workbenches, and APIs. Add new capabilities for data integration, transformation, and visualization using LLMs Optimize workflows for large-scale datasets and improve database support Strengthen developer tools like Jupyter notebooks and SQL workbenches Tech stack: Java, Python, AngularJS, Angular  Data Visualization: elevate our data visualization capabilities with high-performance charting tools and dashboards. Develop new chart types and optimize visualization performance Enhance dash boarding capabilities to deliver fast and flexible experiences Tech stack: React, AngularJS, Angular, D3.js, ECharts, Node.js, Java, Spring AI & Machine Learning: Collaborate on next-gen AI features, from statistics and time series forecasting to LLM inference. Build next-generation features like cross-provider LLM APIs or integration with the latest Machine Learning models Collaborate with research teams on innovative machine learning experiments Tech stack: Python, scikit-learn, TensorFlow, PyTorch, Java, Angular, AngularJS MLOps: Develop back-end capabilities for automating and monitoring ML model lifecycles while supporting cross-functional collaboration. Build tools to automate retraining, monitoring, and deployment of ML models Enhance collaboration features for ML stakeholders Tech stack: Python, Java, Angular, Angular.JS, Kubernetes, Docker Platform: Focus on scaling and securing the platform while improving cloud integrations and supporting a wide array of data sources and engines. Optimize processing engines for scalability and latency Expand capabilities to support new databases and cloud platforms Tech stack: Java, Python, Angular, Kubernetes, Spark, AWS, Azure, GCP AI Governance: Build features for AI compliance, connecting disparate systems and simplifying governance processes. Develop customizable platforms for managing AI compliance and governance Simplify policy enforcement and integration across disparate systems Tech stack: Java, Angular, PostgreSQL  What You Need To Be Successful   We’re stack agnostic, so all you need is a significant experience in software engineering, building a real product We’re hiring at all levels (junior, mid, senior) A passion for combining backend performance with exceptional frontend user experience. You want to work in a fast-paced, high-growth environment that values diversity of talent, excellence of product, and exciting engineering challenges at scale   What does the hiring process look like?   Initial call with a member of our Technical Recruiting team (45min) Video call with an Engineering Team Lead (1h30) Technical Assessment to show your skills (Home Test or Live Coding) Final Interviews with our VPs of Engineering (2h)    What are you waiting for!  At Dataiku, you'll be part of a journey to shape the ever-evolving world of AI. We're not just building a product; we're crafting the future of AI. If you're ready to make a significant impact in a company that values innovation, collaboration, and your personal growth, we can't wait to welcome you to Dataiku! And if you’d like to learn even more about working here, you can visit our Dataiku LinkedIn page.  Our practices are rooted in the idea that everyone should be treated with dignity, decency and fairness. Dataiku also believes that a diverse identity is a source of strength and allows us to optimize across the many dimensions that are needed for our success. Therefore, we are proud to be an equal opportunity employer. All employment practices are based on business needs, without regard to race, ethnicity, gender identity or expression, sexual orientation, religion, age, neurodiversity, disability status, citizenship, veteran status or any other aspect which makes an individual unique or protected by laws and regulations in the locations where we operate. This applies to all policies and procedures related to recruitment and hiring, compensation, benefits, performance, promotion and termination and all other conditions and terms of employment. If you need assistance or an accommodation, please contact us at: reasonable-accommodations@dataiku.com  Protect yourself from fraudulent recruitment activity  Dataiku will never ask you for payment of any type during the interview or hiring process. Other than our video-conference application, Zoom, we will also never ask you to make purchases or download third-party applications during the process. If you experience something out of the ordinary or suspect fraudulent activity, please review our page on identifying and reporting fraudulent activity here.  "
"Software Engineer, Developer Experience with verification",Notion,https://www.linkedin.com/company/notionhq/life,,Reposted 1 hour ago,https://www.linkedin.com/jobs/view/4276096791/?eBP=CwEAAAGaEsZGa4bi7qSXXVEjT11-xVAJf__RM13hNr5B67opQHdPIlLmvbALB6fZB4ekxTyICjgji6egjIePpIxdv9XAt8a3uuD4JbB9spN-GLKL9TnJJC7aQA36HglcUjlhUiLAfIip5MqJpjeHz4Lr2z8dsuA8OWECENY3r1ex_GBIwvNjS8ToUh8zVXCvuQeoPWp3dxsjCNxj6-xNQ-Ioo6mizrFCHVoDk-SwFNbXzGzfmakCGhQO8qAPdqj1c3K9ZWBd1dFnad3RqRTNnvG0SJmPKmZlC08C2Rw0BO4hnfTN-uckEKt6vCVIuG4zgQdjyg_JXZEfak_zEVBf__yqaOZmVqooO6IIdhXSjLtIAzfUjH__H4PBJsNIv8ZzD0ekCsja7qmtXW_MoPwSuxGDHvhsvKJfQ4x2fE2Tn0yX7HU&refId=i2O3%2Fgau2pv%2ByovbJVbZZw%3D%3D&trackingId=tVh%2FoT2ddSb0%2Bkg2PHHXwA%3D%3D&trk=flagship3_search_srp_jobs,,5927,"About the job  About Us  Notion helps you build beautiful tools for your life’s work. In today's world of endless apps and tabs, Notion provides one place for teams to get everything done, seamlessly connecting docs, notes, projects, calendar, and email—with AI built in to find answers and automate work. Millions of users, from individuals to large organizations like Toyota, Figma, and OpenAI, love Notion for its flexibility and choose it because it helps them save time and money.  In-person collaboration is essential to Notion's culture. We require all team members to work from our offices on Mondays and Thursdays, our designated Anchor Days. Certain teams or positions may require additional in-office workdays.  About The Role  Millions of people use Notion — and this number is increasing every day. That means millions of people trust us to deliver a fast, reliable, and secure experience, and we value this more than anything. We want to keep earning trust, while also continuing to amaze our users with the tools they can build in Notion. The Developer Experience team is responsible for architecting, implementing, and scaling the tools and frameworks that Notion developers use to build Notion. We are looking for engineers who are passionate about solving engineering productivity challenges, have deep empathy for other developers, and love to communicate with engineers. You don't need to have experience in this domain but willing to advocate for developer experience is the key.  What You'll Achieve   Collaborate with engineers across the company to deliver an industry-leading developer experience, along the way working deeply with tools like the TypeScript language server, lint tooling, and the Notion CLI to improve developers’ day to day experience. Work on the bleeding edge of tooling performance, researching and evaluating new tools and keeping up with new developments in the developer experience space in the JS ecosystem. Work deeply with GitHub and our CI systems to help ensure engineers can merge their code quickly and safely. We aim for all PR CI pipelines to finish within 15 minutes! Take ownership of our development environment and toolchain, and contribute to novel projects across the company to deliver impact.   Skills You'll Need To Bring   A drive to make developers’ lives better: you have a strong interest in keeping engineers in their flow state through better tooling. You like to think critically about the workflows engineers use in their day to day work, finding bottlenecks and thinking outside of the box to find ways to pave a better golden path for engineers to follow. A focus on user experience: you bring care and craft to the user experience you build into your products. Your work emphasizes simplicity, supportability, and ease-of-use, and you communicate clearly with other teams and engineers to get feedback on where we can improve. Multitasker and present: you like interrupts especially if this is blocking engineers.You switch between your project work and day to day developer experience challenges. Interest in learning how things work: you love to learn how the tools you use work at a fundamental level. You get excited at the idea of digging into third-party source code to understand how they work and find new ways to use them. Pragmatic and business-oriented: You care about business impact and prioritize projects accordingly. You don't just go after cool stuff—you understand the balance between craft, speed, and the bottom line. To you, technologies and programming languages are about tradeoffs. You may be opinionated, but you're not ideological and can learn new technologies as you go.   Nice To Haves   Familiarity with TypeScript, especially in ways to keep it running smoothly in a large codebase. An interest in automated testing and familiarity with testing best practices Past experience with React and common tooling like React Testing Library Past experience on developer experience teams or related tools   We hire talented and passionate people from a variety of backgrounds because we want our global employee base to represent the wide diversity of our customers. If you’re excited about a role but your past experience doesn’t align perfectly with every bullet point listed in the job description, we still encourage you to apply. If you’re a builder at heart, share our company values, and enthusiastic about making software toolmaking ubiquitous, we want to hear from you.  Notion is proud to be an equal opportunity employer. We do not discriminate in hiring or any employment decision based on race, color, religion, national origin, age, sex (including pregnancy, childbirth, or related medical conditions), marital status, ancestry, physical or mental disability, genetic information, veteran status, gender identity or expression, sexual orientation, or other applicable legally protected characteristic. Notion considers qualified applicants with criminal histories, consistent with applicable federal, state and local law. Notion is also committed to providing reasonable accommodations for qualified individuals with disabilities and disabled veterans in our job application procedures. If you need assistance or an accommodation due to a disability, please let your recruiter know.  Notion is committed to providing highly competitive cash compensation, equity, and benefits. The compensation offered for this role will be based on multiple factors such as location, the role’s scope and complexity, and the candidate’s experience and expertise, and may vary from the range provided below. For roles based in San Francisco, the estimated base salary range for this role is $150,000 - $250,000 per year.  By clicking “Submit Application”, I understand and agree that Notion and its affiliates and subsidiaries will collect and process my information in accordance with Notion’s Global Recruiting Privacy Policy.  "
Full Stack Engineer (Development Services) with verification,Odoo,https://www.linkedin.com/company/odoo/life,,59 minutes ago,https://www.linkedin.com/jobs/view/4317968260/?eBP=BUDGET_EXHAUSTED_JOB&refId=i2O3%2Fgau2pv%2ByovbJVbZZw%3D%3D&trackingId=Om623jDj9xcLirsy5efkXg%3D%3D&trk=flagship3_search_srp_jobs,,3431,"About the job  Full Stack Engineer (Development Services)  This is a hybrid (3 days onsite, 2 days remote) role in Buffalo, NY.     To get the best candidate experience, please consider applying for a maximum of 3 applications within 12 months to ensure you are not duplicating efforts.     Applicants must be authorized to work for any employer in the U.S. We are unable to sponsor or assume sponsorship responsibilities for employment visas at this time.     About Odoo  Odoo is an open-source enterprise resource planning (ERP) platform that helps companies manage and streamline their operations through a single, integrated system. Our modular suite of business applications—covering everything from accounting and inventory to CRM and project management—works together seamlessly to support efficiency and growth.     Developed by a global open-source community of engineers and business experts, Odoo has become a flexible, scalable solution for organizations of all sizes. With over 15 million users in 120+ countries and more than 2,000 daily downloads, Odoo is scaling fast, powered by a product-first mindset, a culture of creative problem-solving, and the energy of a startup.     About the Job  Your mission, if you accept it, will be to design, code, review, and debug custom code for our customers. Your tools will be Odoo’s source code, your company-issued computer, and—most importantly—your brain. You’ll bring our clients’ unique business needs to life through smart and maintainable Odoo customizations. You’ll collaborate with other developers, perform code reviews, and ensure the quality and performance of delivered solutions.  In short, you’ll be the bridge between Odoo’s powerful framework and the customer’s specific vision, making sure every customization runs smoothly and efficiently.  Programming Languages: Python, SQL, JavaScript Database: PostgreSQL (with object relational mapping) Collaboration platform: GitHub Development model: Open with external community Framework: Odoo itself is a framework     Responsibilities  Develop solutions for our clients from many different industries, sectors and company size Support and maintain those specific solutions Answer technical questions from our customers and partners     Must Have  Proficient with object-oriented programming languages Understanding of relational databases Ability to learn and evolve quickly Curious and eager to learn Great communicator     Nice to have  Experience with Python and/or JavaScript Contributions to open-source projects Knowledge or experience of how businesses are run (e.g., sales, accounting, inventory management, etc.) Experience with Unix-like systems (Linux, macOS)     Compensation and Perks:  Healthcare, Dental, Vision, Life Insurance, FSA, HSA Matching, 401K Matching, and Commuter Benefits PTO (Paid-time-off), paid sick days, and paid holidays Employee Assistance Program; 3 X 1-hour telehealth calls with certified mental health professionals Evolve in a nice working atmosphere with a passionate, growing team! Chef-prepared lunches - snacks, fruit, and coffee/drinks on tap! Company-sponsored events for groups of 6+ employees     The estimated annual compensation range for this role is $75,000-$100,000. Please note that actual salaries may vary within, above, or below this range based on factors such as education, training, experience, professional achievement, business needs, and location."
Software Engineer,Engtal,https://www.linkedin.com/company/engtal/life,,55 minutes ago,https://www.linkedin.com/jobs/view/4317954842/?eBP=CwEAAAGaEsZGazzQMY-CGm6k5LVzPEkhPcbOknIzsKKk-0P-wnWHzn6-MMEBvlH6RPHjjz9Ie2ZK2QfEZD6fxNBGdbz9_QsV6gIRz0P6VwlDEhDayPgCJ8suVeOjgjwbg7exrfBclhJwKeRCxEb6FrI_HEFVFg8VzoEPFhQwD-t2UL3lGsUrzt-9qj3femaa5-rYwkOX0b2haN_-HiBent0DwczqrhKjuJpig_yA1MnOvJvGf6-R9woViZ_24Bs7ArMTdXxZ65IXFVKLpf7Qz6wEY0TeibdTLwq4BszaI-F9AkiaPC2Nt8u-w6v98pchwPd0dDVjMYnwNJpJL97e8pSUPSASlf3Xm3QdRaXsh9tWCF9urc3rfa3L4qnzf2524BRm_0kn9iw7mHpZk59zi93i2MRsMEFcVSlXtbWsY5Zks3oDM5Ws1KJeJv7jeeCl_XiepaX-gjZpSV6YPJz0JagKWLUAHmSXszD8-kjJSMUN4QouzOCw-e1q-gFKrxxv0-dAFWj_PIZR1g&refId=i2O3%2Fgau2pv%2ByovbJVbZZw%3D%3D&trackingId=sxSyANkQNvpDogDFb9xhyA%3D%3D&trk=flagship3_search_srp_jobs,,2722,"About the job  The Role  We are seeking an experienced and motivated Software Engineer to join our digital technology team. In this position, you will play a key role in designing, developing, and implementing internal software solutions that support business operations and innovation initiatives.  This role is ideal for someone who thrives in a fast-paced, dynamic environment and who enjoys applying technical excellence, creativity, and collaboration to build modern, reliable, cloud-native applications. The position reports to a Principal Software Engineer and involves close collaboration with technical peers and cross-functional partners.  Responsibilities  Apply strong engineering judgment and sound technical decision-making based on best practices. Collaborate with team members to design and deliver high-quality, scalable software solutions. Implement design patterns and modern development techniques to improve system maintainability and extensibility. Solve complex technical problems through elegant, efficient solutions that minimize unnecessary complexity. Promote the adoption of modern engineering practices, tools, and technologies. Participate in code reviews and provide constructive feedback to maintain high standards of code quality. Partner with internal stakeholders and provide technical guidance to non-technical contributors as needed. Stay informed on emerging technologies and trends to continuously strengthen team capabilities. Demonstrate a growth mindset and a commitment to learning and professional development.  Minimum Qualifications  Bachelor’s or master’s degree in Computer Science, Software Engineering, or a related technical discipline (or equivalent experience). 4+ years of professional experience in software engineering, with emphasis on designing and building scalable, complex systems.  Skills & Abilities  Strong expertise in cloud-native development and DevOps methodologies. Solid understanding of microservice architectures and distributed systems. Experience with messaging systems such as Kafka or RabbitMQ. Proficiency in RESTful API design and security best practices. Knowledge of relational database systems (e.g., PostgreSQL, MySQL). Experience with automated testing frameworks and practices (unit, integration, end-to-end). Proficiency in one or more of the following programming languages: Python, Node.js, Java, or C#/.NET. Experience with at least one modern web framework such as React or Angular. Familiarity with Agile development methodologies. Strong analytical and problem-solving skills. Excellent communication skills for both technical and non-technical audiences. Familiarity with the renewable energy or clean technology sector is a plus."
