Job Title,Company,Company Link,Date,Date Text,Job Link,Insights,Description Length,Description
"Software Engineer 2, Supply Chain Delivery (REMOTE) with verification",The Home Depot,https://www.linkedin.com/company/the-home-depot/life,2025-10-23,51 minutes ago,https://www.linkedin.com/jobs/view/4317769048/?eBP=NOT_ELIGIBLE_FOR_CHARGING&refId=GsOrnxCR59dA5KUOu5GmBw%3D%3D&trackingId=Y2lWbhvs%2B76%2BUS3WBqf5eA%3D%3D&trk=flagship3_search_srp_jobs,,4953,"About the job  Req159507  Position Purpose  The Software Engineer II is responsible for independently developing and assisting in the design of a product that our customers and associates love. As a Software Engineer II, you will be part of a dynamic team with engineers of all experience levels who help each other build and grow technical and leadership skills while creating, deploying, and supporting production applications. In addition, Software Engineer IIs may be involved in configuration, security, resilience, performance tuning, and production monitoring.  Key Responsibilities   60% Delivery and Execution - Collaborates and pairs with other product team members (UX, engineering, and product management) to create secure, reliable, scalable software solutions; Documents, reviews and ensures that all quality and change control standards are met; Works with Product Team to ensure user stories that are developer-ready, easy to understand, and testable; Writes custom code or scripts to automate infrastructure, monitoring services, and test cases; Writes custom code or scripts to do destructive testing to ensure adequate resiliency in production; Program configuration/modification and setup activities on large projects using HD approved methodology; Configures commercial off the shelf solutions to align with evolving business needs Creates meaningful dashboards, logging, alerting, and responses to ensure that issues are captured and addressed proactively 20% Learning - Actively seeks ways to grow and be challenged using both formal and informal development channels; Learns through successful and failed experiments when tackling new problems 20% Plans and Aligns - Collaborates with other team members in agile processes; Assists in creating new and better ways for the team to be successful; Relates openly and comfortably with diverse groups of people; Builds partnerships and works collaboratively with others to meet shared objectives   Direct Manager/Direct Reports   This position typically reports to the Software Engineer Manager or Sr. Manager This position has 0 Direct Reports   Travel Requirements   No travel required.   Physical Requirements   Most of the time is spent sitting in a comfortable position, with frequent opportunities to move about. On rare occasions, there may be a need to move or lift light articles.   Working Conditions   Located in a comfortable indoor area. Any unpleasant conditions would be infrequent and not objectionable.   Minimum Qualifications   Must be eighteen years of age or older. Must be legally permitted to work in the United States.   Preferred Qualifications   1–3 years of professional software engineering experience, ideally supporting supply chain, logistics, or carrier communications systems Proficiency in Java, with hands-on experience developing and maintaining object-oriented applications Practical experience working with Cassandra or other distributed NoSQL databases, including data modeling and query optimization Experience deploying, managing, and troubleshooting applications on Google Kubernetes Engine (GKE) or similar container orchestration platforms Strong understanding of microservice-based architectures and building scalable, resilient backend services Familiarity with writing SQL queries against relational databases and integrating with both relational and NoSQL data stores Experience with source code version control systems (such as Git), including branching, merging, and code review best practices Exposure to CI/CD pipelines and automated deployment tools Experience with modern debugging, monitoring, and root cause analysis techniques in distributed systems Exposure to security frameworks for user and service authentication and authorization Experience creating and executing unit, integration, and performance tests Familiarity with front-end technologies (HTML, CSS, JavaScript/TypeScript frameworks) is a plus Strong communication and collaboration skills, with the ability to work effectively in a cross-functional, agile team environment   Minimum Education   The knowledge, skills, and abilities typically acquired through the completion of a bachelor's degree program or equivalent degree in a field of study related to the job.   Preferred Education   No additional education   Minimum Years Of Work Experience   2   Preferred Years Of Work Experience   No additional years of experience   Minimum Leadership Experience   None   Preferred Leadership Experience   None   Certifications   None   Competencies   Global Perspective Manages Ambiguity Nimble Learning Self-Development Collaborates Cultivates Innovation Situational Adaptability Communicates Effectively Drives Results Interpersonal Savvy   Benefits offered include healthcare benefits, a 401 (k) plan, ESPP, paid time off, and a success-sharing bonus. For a full list of the various benefits The Home Depot offers, visit https://careers.homedepot.com/our-benefits."
Full-Stack Engineer - Applicant Tracking System,INVEXOS,https://www.linkedin.com/company/invexos/life,,3 hours ago,https://www.linkedin.com/jobs/view/4319060484/?eBP=BUDGET_EXHAUSTED_JOB&refId=GsOrnxCR59dA5KUOu5GmBw%3D%3D&trackingId=pponknWCK5KPrUdzTzUGgw%3D%3D&trk=flagship3_search_srp_jobs,,4161,"About the job  About the Role  INVEXOS is seeking an experienced Full-Stack Engineer to build our applicant tracking system from the ground up. You'll own the entire technical architecture from database design to candidate-facing interfaces and rapidly deliver a production-ready ATS that transforms how we manage recruiting and hiring. This is a high-impact role for an engineer who understands recruiting workflows, thrives on greenfield development, and wants to see their work directly influence how we build our teams.     Work Authorization: Must be authorized to work in the United States without requiring sponsorship now or in the future     What You'll Do  Architect and build the complete ATS from scratch including candidate pipeline management, job postings, application workflows, interview coordination, and hiring analytics Design scalable database schemas for candidate data, recruiting workflows, and multi-stage hiring pipelines Build robust APIs and integrations for resume parsing, job board distribution, calendar scheduling, email communication, and background check services Create intuitive interfaces for recruiters, hiring managers, and candidates that make complex hiring workflows simple and efficient Make critical technical decisions about system architecture, data models, and integrations—then ship features quickly to support our growing organization     What We're Looking For     Required Qualifications  5-8 years of full-stack development experience with proven ability to architect and build complete systems independently, including deep backend expertise in Node.js, Python, Ruby on Rails, or similar frameworks and strong frontend skills with React, Vue.js, or Angular ATS, HR Tech, or Recruiting Software experience with previous work building recruiting platforms, with an understanding of recruiting workflows, candidate pipelines, interview coordination, and hiring processes Database and API expertise designing complex schemas for workflow automation and multi-stage pipelines, plus experience building integrations with job boards, calendar systems, email platforms, and document processing (resume parsing highly valuable) Startup or early-stage experience coding products quickly in fast-paced environments, making sound technical tradeoffs autonomously, and owning features end-to-end from architecture to deployment Work authorization to work in the United States without requiring sponsorship now or in the future, with cloud platform proficiency (AWS, Azure, or GCP) and comfort with modern development practices     What We Value  Fast Learner: Ability to pick up new technologies and concepts quickly Self-Starter: Proactive about asking questions and seeking solutions Communication: Clear written and verbal communication skills Attention to Detail: Pride in writing clean, well-tested code Growth Mindset: Eager to receive feedback and continuously improve     Work Arrangement  Location: Chicago, IL (hybrid) Schedule: 3-4 days a week required in-office (Gold Coast Chicago) for collaboration and mentorship     Compensation & Benefits  Salary: $120,000 - $160,000 based on experience and background Equity: Equity stake in a growing company     What We're Building  You'll be working on systems that include:  Business applications that drive private equity operations Relationship management tools Financial data integration and reporting platforms  This isn't about building trivial features—you'll work on real, complex problems that matter to the business.     Our Culture  Small Team: Everyone's contribution matters and is visible Move Fast: We ship quickly and iterate based on feedback Learn by Doing: We believe the best way to grow is by building real things High Standards: We care about code quality, but we also ship and learn Direct Communication: No corporate BS—we're honest about what's working and what isn't     Ready to Apply?  We're looking for hungry, smart engineers who want to grow fast in a startup environment. If you're excited about building real products, learning from experienced engineers, and having meaningful impact early in your career, we want to hear from you."
Ruby Backend Software Engineer with verification,Zelis,https://www.linkedin.com/company/zelis/life,,55 minutes ago,https://www.linkedin.com/jobs/view/4323905198/?eBP=CwEAAAGaEsesoCFuxUuvJ6syqUYh_E-uwmC-fEO8bgSwVUnB2L1-Y4C7MlnTr4-SZSlRLXTiMM9bzATtg7JQmUGfok787iExmlbcq5pPBf5sTBvx3hdAYHpAXitRzWWQ8YyqWRjjO5GXWMZb322Z0_kHHBQ7dpPzhOp1wCKiPYXH8RgEDpnfasd_wfS7Wx7dHd87hPdkIHh_WmAFrRf8ZiNzFKHVAkosDW6IRTkzqhFxWe4_fqMAs55FIdHgwN-h5tVyVUd90nAiqRN_R4WiRng4PKqKRz7eWz5t33NfWIgb3qR1T7fXcgLF2NPodlGm-JcQyMp5kxWW7vPCP8Zvr_vYt2r4vL8QRkkWyD61EuaYSnr5JckiXYySS3HJ7hjmozShAPFV2qRPKZ79vHZ203byIouIvTg61tmJNlsM5ve2sIAOhcuwV4FhGWr4rk7ifyj8YdWs660DVftPMrfVvNjmAXD0DGfIFm-PywCW0Enmd99a4txzwnzwrk1db9lsN3-3nJ6K&refId=GsOrnxCR59dA5KUOu5GmBw%3D%3D&trackingId=glPEunihnldkweWOyJGdSg%3D%3D&trk=flagship3_search_srp_jobs,,2791,"About the job  Candidates Must be located 50-100 miles from one of the following locations:   Morristown, NJ;  Boston, MA;  Atlanta, GA;  St Petersburg, FL;  St Louis, MO; or  Plano, TX.     Our ideal candidate is a Ruby Backend Software Engineer (2-3 years) with experience building scalable production applications, working with large data sets, and owning the entire development lifecycle. You will need to be a team player while collaborating closely with our product managers to enhance our mature, complex product. You will get to work with Angular, Ruby, AWS, among other technologies.     We offer comprehensive onboarding, career guidance, a competitive salary, a remote-friendly workspace, and continuing education support. We follow an Agile methodology in small software teams. This is an amazing opportunity for a hands-on, motivated Software Engineer who can define and implement new and challenging technical projects.     What You’ll Do:  Write easily maintainable, extendable, and understandable code that adheres to software engineering design principles. Creating and maintaining our APIs. Developing new full-stack features to improve our products. Supporting and enhancing current systems. Debugging and optimizing code. Supporting and development of comprehensive documentation and tests. Building tooling to improve our operational efficiency. Developing the frontend experience using Angular. Creating and maintaining our Backend architecture. Planning and maintaining a product long term. Performing code reviews. Collaborating with product to deliver on the roadmap.     What You’ll Bring to Zelis:  2-3 years of backend development experience in Ruby. Solid understanding of system design, data structures, and algorithms. Understanding on how to build distributed high-volume services in Ruby. Knowledge of development best practices (agile methodologies, code reviews, backend testing frameworks). Experience in backend architecture. Experience with or understanding of front-end development, particularly Angular, to effectively collaborate on full-stack features Experience working with AWS. Knowledge of API architecture development and optimization. Solid understanding of relational databases like PostgreSQL. Understanding of Apache Solr or willingness to learn. Exposure to queueing systems such as RabbitMQ or willingness to learn. Experience contributing to products in a production environment (product lifecycle, sticking to release schedules, etc.). Knowledge of development best practices (agile methodologies, code reviews, JavaScript testing frameworks).     Our Stack  Languages (JavaScript, Typescript, Ruby) Frameworks (Angular, Ruby on Rails) Infrastructure (RDS, EC2, S3, CloudFront, Redis, Docker, Jenkins, PostgreSQL, RabbitMQ, Apache Solr)"
Software Engineer {S},"ARKA Group, LP",https://www.linkedin.com/company/arka-group-technologies/life,2025-10-23,1 hour ago,https://www.linkedin.com/jobs/view/4319098131/?eBP=NOT_ELIGIBLE_FOR_CHARGING&refId=GsOrnxCR59dA5KUOu5GmBw%3D%3D&trackingId=difVdVLGKFi757uelfHQqQ%3D%3D&trk=flagship3_search_srp_jobs,,6778,"About the job  ARKA Group L.P. (“ARKA”) is an advanced technologies company serving the U.S. military, intelligence community, and commercial space industry delivering next-generation solutions to support the national security space enterprise. Built on more than six decades of excellence, ARKA brings modern approaches and a culture of innovation to the challenges of today.  By joining our team, you will be part of teams building innovative software solutions to support users in the defense and intelligence communities. Your strong technical skills and passion for innovation will be instrumental in supporting our customers and their missions to keep us safe.  Position Overview  We are seeking a highly skilled and experienced Java Developer who can be a technical leader and drive projects from conception to completion, ensuring the delivery of high-quality software solutions. This role requires a blend of hands-on coding expertise, strategic planning, and excellent communication skills to bridge the gap between business needs and technical implementation.  The team is primarily based in Ypsilanti, Michigan and we welcome candidates from that area, however, remote candidates may also be considered. Candidates will be asked to obtain a TS//SCI security clearance.  In support of work/life balance, many positions are available for a flexible schedule within the pay period. Ask us about the opportunity for flex scheduling if that’s of interest to you.  Responsibilities   Software Development: Design, document, develop, and maintain robust, high-performance, and scalable applications using Java and related technologies Technical Architecture: Contribute to updating and modernizing the architectural design of the existing system, ensuring it is designed for usability, performance efficiency, maintainability and cyber-security. Ultimately optimizing for cloud deployment (microservices, containerization) Quality Assurance: Oversee code reviews, conduct testing, and ensure adherence to best practices and coding standards Collaboration: Act as a liaison between the development team and other departments, including finance, accounting, technical management and engineering   Required Qualifications   US citizenship and ability to obtain and maintain a TS/SCI U.S. Government Security Clearance Experience: Minimum of 5 years of professional experience in Java development with at least 3 years in a cloud development role Technical Skills: Java: Extensive experience with core Java, Spring Framework (Spring Boot, Spring MVC, Spring Cloud), and Hibernate Cloud Platforms: Hands-on experience with at least one major cloud provider (AWS, Azure, or GCP) DevOps & Containers: Familiarity with containerization technologies like Docker and orchestration tools like Kubernetes Databases: Proficiency in SQL and experience with relational databases such as Oracle, PostgreSQL or MySQL Web Technologies: Strong understanding of RESTful APIs, microservices architecture, and cloud platforms (AWS, Azure, or GCP) Tools: Experience with Git, Maven/Gradle, and CI/CD pipelines (Jenkins, GitLab CI) AI/ML Framework Experience: Familiarity with Java-compatible AL/ML libraries and frameworks (i.e. Spring AI, DL4J, Weka, LangChain4j) Soft Skills: Analysis: Exceptional skills in requirements gathering and business analysis Communication: Excellent written and verbal communication skills Problem-Solving: Strong analytical and problem-solving abilities  Location: Ypsilanti, MI   Remote candidates may also be considered   Ypsilanti is artistic, genuine, and original. A college town and city located on the Huron River in Washtenaw County. Ypsilanti is all about community and making families new to the area feel right at home. From educational opportunities and local museums for all ages, to accessible healthcare and transportation it’s a wonderful location. It’s well known for its historical museums, parks, and historic districts as well as home to Eastern Michigan University. The University of Michigan and Michigan State University also are great institutions! Ann Arbor is close by and has many things, including a bustling university town, culinary hotspot, and a tech hub with a walkable downtown that includes world-class arts and culture. Located in southeast Michigan's Lower Peninsula, Ann Arbor lies at the center of a greater collection of communities in Washtenaw County. With so many thriving communities nearby, Ann Arbor has become a cultural melting pot and urban oasis.  Remote  This can be a remote position that will primarily be supporting our Ypsilanti location based out of the Eastern Standard Time (ET) time zone.  What We Offer   Comprehensive medical/vision/dental insurance packages Company contributions to qualified HSA accounts 401k retirement plan with industry leading company contributions 3 weeks of vacation accrual per year plus time off for sick leave and unscheduled life events 13 paid holidays Upfront tuition assistance for approved degree programs Annual bonus program based on company and employee performance Company paid life insurance, AD&D, Short-Term and Long-Term disability insurance 4 weeks paid Parental Leave Employee assistance program (EAP)   EHS/Environmental Requirements  This job operates in a professional office environment. While performing the duties of this job, the employee routinely is required to use hands to keyboard, communicate, listen to, and interpret instructions and remain stationary for extended periods of the time. This would require the ability to move around the campus and occasionally move/lift items weighing up to 25 lbs. Reasonable accommodations may be made to enable individuals with disabilities to perform the essential functions of the job.  Applicants are invited to apply for a reasonable accommodation to perform the essential duties of the job. To apply, send a request to staffing@arka.org or contact 203-797-5000 and press 2 for Human Resources.  ITC & Security Clearance Requirements  This position requires the ability to obtain and maintain a TS/SCI U.S. Government Security Clearance.  This position also requires U.S. citizenship in support of contract requirements. Additionally, if you are a dual citizen (a citizen of the U.S. and another country), the Company must obtain approval for you to have access to the information required for this position. You will not be able to begin employment until such approval is obtained and this may take several months.  Visa Restrictions  No visa sponsorship is available for this position.  Pre-employment Screenings  Employment with any ARKA companies in the U.S. is contingent upon satisfactory completion of several pre-employment requirements to include a credit check, background check, and drug screen."
